book,author,urls,text
Эдем, Джейми Макгвайр,https://enjoybooks.pw/edem/,"Заключительная часть запретной любви ангела Джареда и молодой девушки Нины. Тут читатель получит еще больше захватывающего и динамичного сюжета, наполненного … "
Реквием, Джейми Макгвайр,https://enjoybooks.pw/rekviem/,"Вторая часть истории любви девушки Нины и ее ангела-хранителя Джареда. Подходит время свадьбы. Девушка видит часто один сон, где отцы … "
Провидение, Джейми Макгвайр,https://enjoybooks.pw/providenie/,"Роман рассказывает историю запретной любви между ангелом-полукровкой и человеком. Их взаимоотношения только развиваются, а уже вызывают множество сложностей. Джаред – … "
Моя прекрасная жертва, Джейми Макгвайр,https://enjoybooks.pw/moya-prekrasnaya-zhertva/,"Роман повествует о девушке Фэлин Фэйрчайлд, дочери будущего губернатора Колорадо, работающей официанткой. Когда-то она сбежала из колледжа и от родителей, … "
Мое прекрасное искупление, Джейми Макгвайр,https://enjoybooks.pw/moe-prekrasnoe-iskuplenie/,Роман рассказывает о судьбе старшего из братьев Медоксов – Томаса. Он работает агентом в ФБР и искренне помешан на собственной … 
Мое прекрасное забвение, Джейми Макгвайр,https://enjoybooks.pw/moe-prekrasnoe-zabvenie/,Трэнтон Мэддокс является старшим братом Трэвиса и по характеру сильно схож с ним. Он казанова и любит красиво отдохнуть. Камилла … 
Моя прекрасная свадьба, Джейми Макгвайр,https://enjoybooks.pw/moya-prekrasnaya-svadba/,В финале истории Эбби и Трэвиса в книге «Мое ходячее несчастье» есть небольшое упоминание о побеге героев в Лас-Вегас. Здесь … 
Мое ходячее несчастье, Джейми Макгвайр,https://enjoybooks.pw/moe-hodyachee-neschaste/,"История повторяет предыдущую часть «Мое прекрасное несчастье», но рассказывает ее от лица Трэвиса Мэддокса. Она дополняет первую книгу, раскрывая бурное … "
Мое прекрасное несчастье, Джейми Макгвайр,https://enjoybooks.pw/moe-prekrasnoe-neschaste/,"Легкий любовный роман повествует о главном герое – красавчик Трэвис. Он пользуется повышенным вниманием в университете, но ищет ту самую. … "
Я была здесь, Гейл Форман,https://enjoybooks.pw/ya-byla-zdes/,"Автор книги заявляет, что «Я была здесь» написана на реальных событиях трагической смерти Сьюзи Гонсалес. В книжной истории используются измененные … "
Оставьте меня, Гейл Форман,https://enjoybooks.pw/ostavte-menya/,"Книга Гейл Форман «Оставьте меня» о том, как важно для женщины однажды в жизни бросить все и посвятить время себе. … "
Куда она ушла, Гейл Форман,https://enjoybooks.pw/kuda-ona-ushla/,"Книга «Куда она ушла» стала гармоничным продолжением истории, начатой в произведении Гейл Форман «Если я останусь». Проходит три года после … "
Если я останусь, Гейл Форман,https://enjoybooks.pw/esli-ya-ostanus/,"«Если я останусь» — драматичная и глубокая эмоциональная история. Главная героиня, 17-летняя Мия, попадает в страшную аварию. В ее жизни … "
Всего один день. Лишь одна ночь, Гейл Форман,https://enjoybooks.pw/vsego-odin-den-lish-odna-noch/,"В этой книге Гейл Форман рассказывает о молодой девушке, избегающей различные поездки. Но главной героине все-таки приходится готовиться к долгой … "
Только один год. Лишь одна ночь, Гейл Форман,https://enjoybooks.pw/tolko-odin-god-lish-odna-noch/,Продолжением истории Уиллема и Эллисон становится произведение Гейл Форман «Только один год. Лишь одна ночь». Трагическая случайность разлучает пару после … 
12 историй о настоящей любви, Гейл Форман,https://enjoybooks.pw/12-istorij-o-nastoyashhej-lyubvi/,"Сборник романтических «12 историй о настоящей любви» посвящен самому снежному и праздничному времени года. Зима, Рождество и такие теплые и … "
Последний подарок, Джессика Клэр,https://enjoybooks.pw/poslednij-podarok/,"Продолжение истории взаимоотношений Николая и Дейзи продолжаются в произведении Джессики Клэр «Последний подарок». История припадает на праздничное зимнее время, когда … "
Последний удар, Джессика Клэр,https://enjoybooks.pw/poslednij-udar/,"«Последний удар» — история наемного убийцы и девушки, которую всю жизнь оберегали и защищали от внешнего мира. Николай выглядит достаточно … "
В постели ни с тем миллиардером, Джессика Клэр,https://enjoybooks.pw/v-posteli-ni-s-tem-milliarderom/,"«В постели ни с тем миллиардером» — история Одри Петти, правильной, успешной и надежной девушки. Героиня влюблена в друга детства … "
Красавица и миллиардер, Джессика Клэр,https://enjoybooks.pw/krasavitsa-i-milliarder/,Еще одна история Джессики Клэр о миллиардере. На этот раз в книге «Красавица и миллиардер» рассказывается о земельном магнате Хантере … 
Унесенная с миллиардером, Джессика Клэр,https://enjoybooks.pw/unesennaya-s-milliarderom/,"Джессика Клэр в своей книге посвящает читателя в члены «Клуба Миллиардеров». Шесть мужчин, добившихся серьезных успехов в разнообразных сферах, составляют … "
Женское руководство по охоте (на мужчин), Джессика Клэр,https://enjoybooks.pw/zhenskoe-rukovodstvo-po-ohote-na-muzhchin/,«Женское руководство по охоте (на мужчин)» рассказывает читателям о жизни Миранды. Девушка всегда ощущала себя бессильной и незащищенной от мира. … 
Голубое Нигде, Джеффри Дивер,https://enjoybooks.pw/goluboe-nigde/,Современный зарубежный детектив с элементами триллера «Голубое Нигде» автора Джеффри Дивера погружает читателя в мир разгадок преступлений. В этот раз … 
Печальный урожай, Дженнифер Роу,https://enjoybooks.pw/pechalnyj-urozhaj/,"Психологический интеллектуальный детектив. Роман рассказывает об убийстве, произошедшем в замкнутом пространстве. Главная героиня – старушка Алиса, которая нуждается в помощи … "
Игра стоит свеч, Валери Шелдон,https://enjoybooks.pw/igra-stoit-svech/,"В книге «Игра стоит свеч» Валерии Шелдон затрагивает тему, волнующую тысячи людей. Может ли существовать истинная дружба мужчины и женщины? … "
Какие книги похожие на книгу В тихом омуте: Пола Хокинс,,https://enjoybooks.pw/kakie-knigi-pohozhie-na-v-tihom-omute-pola-hokins/,"Британская писательница Пола Хокинс наиболее известна романом «Девушка в поезде», получившим экранизацию. Она любит поднимать серьезные темы и облекать их … "
Мой Эрмитаж, Михаил Пиотровский,https://enjoybooks.pw/moj-ermitazh/,"Автор этой книги Михаил Пиотровский, вот уже двадцать два года трудится на должности — директор Эрмитажа. Поэтому он может по … "
Останься со мной навсегда, Валентина Шигина,https://enjoybooks.pw/ostansya-so-mnoj-navsegda/,"Еще одна любовная история Валентины Шигиной разворачивается в романе «Останься со мной». Главные герои – молодые люди 20 лет, повидавшие … "
Нищенка и Король, Валентина Шигина,https://enjoybooks.pw/nishhenka-i-korol/,"Обыграв в своем произведении историю «новой Золушки», Валентина Шигина рассказывает о том, как простая девушка влюбляет в себя Казанову. «Нищенка … "
Красавица и Чудовище, Валентина Шигина,https://enjoybooks.pw/krasavitsa-i-chudovishhe/,В книге «Красавица и Чудовище» Валентине Шигиной удалось отлично раскрыть тему способности человека раскрыть другого человека. Главная героиня всегда была … 
Я считаю до пяти, Валентина Шигина,https://enjoybooks.pw/ya-schitayu-do-pyati/,В книге Валентины Шигиной «Я считаю до пяти» отношения развиваются между преподавателем и студенткой. Она ничего не смыслит в математике … 
Просто танцуй, Валентина Шигина,https://enjoybooks.pw/prosto-tantsuj/,"Любовный роман «Просто танцуй» сплетает в сюжете танцы и любовь, создавая мощный коктейль. Даже начнется он с просмотра персонажами танцевального … "
Потанцуй со мной, Валентина Шигина,https://enjoybooks.pw/potantsuj-so-mnoj/,"«Потанцуй со мной» — это современный любовный роман, являющийся продолжением истории взаимоотношений Димы и Тани. С ними читатель мог познакомиться … "
Плакучая ива, Анна Тодд,https://enjoybooks.pw/plakuchaya-iva/,"Новая история Анны Тодд ведется от лица главной героини, в жизни которой сейчас самый лучший период. Она поступила в колледж … "
Ничего больше, Анна Тодд,https://enjoybooks.pw/nichego-bolshe/,"«Ничего больше» — эротический любовный роман, ставший историей Лэндона в период ссоры известных по книгам Тодд героев – Хардина и … "
До того как, Анна Тодд,https://enjoybooks.pw/do-togo-kak/,Любовный роман Анны Тодд «До того как» становится пятым в цикле и повествует об уже знакомой истории пары Хардина и … 
Танец с драконами, Джордж Р. Р. Мартин,https://enjoybooks.pw/tanets-s-drakonami/,"Пятая книга из цикла «Песнь Льда и Пламени», ставшего культовым сразу в нескольких странах, возвращает читателям любимых главных героев. Так … "
Пир стервятников, Джордж Р. Р. Мартин,https://enjoybooks.pw/pir-stervyatnikov/,"В четвертой части фантастической саги «Песнь Льда и Пламени» значительно расширится карта мира, придуманного Джорджем Мартином. Автор расскажет о врагах … "
Буря мечей, Джордж Р. Р. Мартин,https://enjoybooks.pw/burya-mechej/,"«Буря мечей» занимает третью ступень в истории Вестероса, описанной в «Песни Льда и Пламени». Джордж Мартин снова удивляет сюжетными ходами, … "
Битва королей, Джордж Р. Р. Мартин,https://enjoybooks.pw/bitva-korolej/,Книга «Битва королей» становится второй частью легендарной саги «Песнь Льда и Пламени» Джорджа Мартина. Ему удалось вновь создать удивительную и … 
В свои разрушенные тела вернитесь, Филипп Фармер,https://enjoybooks.pw/v-svoi-razrushennye-tela-vernites/,"Книга Филиппа Фармера – это попытка предположить развитие событий, если все умершие в одночасье оживут. Люди, различные религией, расами, временными … "
В направлении Окна, Андрей Лях,https://enjoybooks.pw/v-napravlenii-okna/,"«В направлении Окна» — это история в жанре научной фантастики, а значит, читателя ждут космические приключения главных героев. В основе … "
Бог света. Князь света, Роджер Желязны,https://enjoybooks.pw/bog-sveta-knyaz-sveta/,«Князь тьмы» по достоинству считается одним из самых запоминающихся и интригующих произведений Роджера Желязны. События происходят на фоне религии и … 
Чужак в чужой стране, Роберт Хайнлайн,https://enjoybooks.pw/chuzhak-v-chuzhoj-strane/,"«Чужак в чужой стране» — философский фантастический роман, рассказывающий о Человеке с Марса. Не марсианине, а человеке, родившемся непосредственно на … "
Игра форов, Лоис Макмастер Буджолд,https://enjoybooks.pw/igra-forov/,"«Игра форов» гармонично продолжает историю адмирала Майлза Нейсмита, который благополучно закончил Военную Академию Барраяра и вернул себе титул и фамилию … "
Игра Эндера, Орсон Скотт Кард,https://enjoybooks.pw/igra-endera/,"«Игра Эндера» — это книга о войне, которую ведет человечество. Победа в ней означает извечное одиночество во Вселенной. События сначала … "
Контракт на Фараоне, Рэй Олдридж,https://enjoybooks.pw/kontrakt-na-faraone/,"Главный герой, профессиональный наемник Руиз Ав, внедрен Лигой Искусств на чужую планету Фараон, чтобы найти рабовладельцев-контрабандистов, обращающихся с людьми как … "
Линия грёз, Сергей Лукьяненко,https://enjoybooks.pw/liniya-gryoz/,"«Линия грез» рассказывает о мире далекого будущего, который постигла Смутная война. Она унесла за собой миллиарды людей, и теперь человечеству … "
Дюна, Фрэнк Херберт,https://enjoybooks.pw/dyuna/,"«Дюна» относится к жанру планетарной фантастики. Это история отдельно взятой планеты Арракис, давно ставшей в сознании читателей нарицательным именем, означающим … "
Гиперион, Дэн Симмонс,https://enjoybooks.pw/giperion/,«Гиперион» Дэна Симмонса входит в знаменитую тетралогию автора в жанре космической оперы. Это уникальный мир порталов на разные планеты и … 
Вера, Джон Лав,https://enjoybooks.pw/vera/,Входящая в раздел боевой зарубежной фантастики книга «Вера» повествует об инопланетном космическом корабле с идентичным названием. Когда-то он уничтожил Шахранскую … 
Обреченный мир, Аластер Рейнольдс,https://enjoybooks.pw/obrechennyj-mir/,"События книги «Обреченный мир» происходят в далеком будущем, в котором Земля неминуемо умирает. Остается единственный город человечества, проходящий через всю … "
Поток, Дэниэл Суарез,https://enjoybooks.pw/potok/,"В книге «Поток» рассматривается далекое будущее, где некая секретная и обладающая могуществом организация старается сдержать прогрессирующие технологии. Для этого сотрудники … "
Стеклянный Джек, Адам Робертс,https://enjoybooks.pw/steklyannyj-dzhek/,"Книга, написанная в жанре зарубежной научной фантастики с ярко выраженной детективной линией. В основе сюжета три истории, основным героем которых … "
Во тьме Эдема, Крис Бекетт,https://enjoybooks.pw/vo-tme-edema/,"Крис Беккет создал собственную вселенную, где планету населяют потомки двух землян, поневоле ставших прородителями целого мира. Оказавшись более 150 лет … "
Ложная слепота, Питер Уоттс,https://enjoybooks.pw/lozhnaya-slepota/,"Питер Уоттс – ученый-гидробиолог, поэтому его «Ложная слепота» содержит большое количество научной терминологии. Это не помешало ей стать одной из … "
Утраченный символ, Дэн Браун,https://enjoybooks.pw/utrachennyj-simvol/,"Еще одна история о расследованиях профессора Роберта Лэнгдона, занимающегося изучением символики. Теперь ему предстоит окунуться в тайны масонского братства. На … "
Код да Винчи, Дэн Браун,https://enjoybooks.pw/kod-da-vinchi/,"Первая книга из серии о профессоре Гарвардского университета Роберте Лэнгдоне, занимающегося изучением разнообразных символов. В основе сюжета лежит расследование, связанное … "
Точка обмана, Дэн Браун,https://enjoybooks.pw/tochka-obmana/,«Точка обмана» не похожа на другие произведения Дэна Брауна. Сюжет строится вокруг политических событий – выборов президента США. Также присутствует … 
Ангелы и демоны, Дэн Браун,https://enjoybooks.pw/angely-i-demony/,Главный герой произведения Дэна Брауна «Ангелы и Демоны» — профессор Роберт Лэнгдон. Он преподает в Гарварде и занимается изучением религиозной … 
Цифровая крепость, Дэн Браун,https://enjoybooks.pw/tsifrovaya-krepost/,"В «Цифровой крепости» Дэн Браун раскрывает проблематику шифрования информации. В основе сюжета лежит история разработки секретного кода, который нельзя взломать. … "
Подобно реке, Пауло Коэльо,https://enjoybooks.pw/podobno-reke/,"Это сборник рассказов Пауло Коэльо, где каждая история имеет собственного главного героя. Объединяет их лишь то, что все они встречаются … "
Одиннадцать минут, Пауло Коэльо,https://enjoybooks.pw/odinnadtsat-minut/,"«Одиннадцать минут» стал одним из скандальнейших романов Пауло Коэльо. В основе сюжета лежит история девушки Марии, оказывающей сексуальные услуги. В … "
Дьявол и сеньорита Прим, Пауло Коэльо,https://enjoybooks.pw/dyavol-i-senorita-prim/,Еще одно философское творение бразильского писателя Пауло Коэльо. Книга «Дьявол и сеньорита Прим» начинается с приезда в небольшой городок Вискос … 
Вероника решает умереть, Пауло Коэльо,https://enjoybooks.pw/veronika-reshaet-umeret/,"Главная героиня Вероника действительно задумала самоубийство. Вот только воплотить его в жизнь девушке не дают. Попытка убить себя проваливается, и … "
Валькирии, Пауло Коэльо,https://enjoybooks.pw/valkirii/,"Пауло Коэльо написал автобиографическую книгу «Валькирии», приукрасив реальность художественными моментами. Это история о поиске своего я и личного ангела-хранителя. Автор … "
Грехи отца, Китти Нил,https://enjoybooks.pw/grehi-ottsa/,"Классический женский любовный роман, повествующий о судьбе Эммы Чемберс. Это смелая и отважная девушка, которой придется бороться с перипетиями судьбы … "
Книга Аарона, Джим Шепард,https://enjoybooks.pw/kniga-aarona/,Это тяжелая история еврейского мальчика в период нацистского вторжения в Варшаву. Именно от его лица ведется повествование. Мать всегда занята … 
