book,author,urls,text
Конклав Бессмертных. Проба сил, Виталий Валерьевич Зыков,https://enjoybooks.pw/konklav-bessmertnyh-proba-sil/,Увлекательное произведение популярного российского автора написано в жанре боевое фэнтези и является второй книгой захватывающего цикла «Война за выживание». События … 
Успеть до радуги, Андрей Борисович Земляной,https://enjoybooks.pw/uspet-do-radugi/,Захватывающее произведение талантливого писателя представлено в жанре боевое фэнтези и является одним из романов увлекательной серии «Странник». Талантливый автор использовал … 
Рыцари Пречистой Девы, Александр Валентинович Рудазов,https://enjoybooks.pw/rytsari-prechistoj-devy/,Увлекательное произведение популярного российского писателя представлено в жанре фэнтези и является одним из романов захватывающего цикла «Архимаг». Во второй книге … 
"Misterium Tremendum. Тайна, приводящая в трепет", Полина Дашкова,https://enjoybooks.pw/misterium-tremendum-tajna-privodyashhaya-v-trepet/,Захватывающее произведение талантливой коренной москвички написано в детективном жанре и является второй книгой романа «Источник счастья». В основе событий – … 
Дороги и сны, Оксана Панкеева,https://enjoybooks.pw/dorogi-i-sny/,"Удивительно подходящее название подобрано книге: здесь будет множество вещих снов и далеких дорог, которые предстоит пройти героям на пути к … "
Командир, Владимир Геннадьевич Поселягин,https://enjoybooks.pw/komandir/,"Увлекательный роман известного талантливого автора написан в жанрах альтернативная история, фэнтези и является первой книгой захватывающего цикла историй про попаданца … "
Киндрэт. Кровные братья, Алексей Юрьевич Пехов,https://enjoybooks.pw/kindret-krovnye-bratya/,Увлекательное произведение популярного талантливого автора написано в жанре городское фэнтези и является первой книгой захватывающего цикла «Киндрэт». В основе повествования … 
Эротические рассказы – Группа, Stulchik,https://enjoybooks.pw/eroticheskie-rasskazy-gruppa/,"Оригинальный сборник содержит увлекательные рассказы интимного характера, которые предназначены для возрастной категории людей старше восемнадцати лет. В небольших произведениях подробно … "
Десант «попаданцев». Второй шанс для человечества, Александр Сергеевич Конторович,https://enjoybooks.pw/desant-popadantsev-vtoroj-shans-dlya-chelovechestva/,Захватывающий роман популярного писателя является первой книгой увлекательной серии «Десант попаданцев» и представлен в жанре фэнтези.  На этот раз во … 
Спецназ Третьей Мировой. Русские козыри, Андрей Владимирович Загорцев,https://enjoybooks.pw/spetsnaz-tretej-mirovoj-russkie-kozyri/,"Захватывающий роман популярного писателя из серии «Третья мировая война» представлен в жанрах боевая, историческая фантастика. Талантливый автор в своей книге … "
Бог как иллюзия, Клинтон Ричард Докинз,https://enjoybooks.pw/bog-kak-illyuziya/,"Научно-познавательное произведение выдающегося британского ученого–этолога, профессора Оксфордского университета, известного популяризатора науки, ярого сторонника дарвинской теории эволюции вызвало бурные дискуссии у … "
Второй фронт, Владимир Геннадьевич Поселягин,https://enjoybooks.pw/vtoroj-front/,"Захватывающая книга талантливого автора написана в жанрах боевое фэнтези, альтернативная история и является вторым произведением увлекательного цикла «Аномалия». Писатель заставляет … "
Рыцарь двух миров, Сергей Садов,https://enjoybooks.pw/rytsar-dvuh-mirov/,Увлекательный роман популярного талантливого российского писателя написан в жанре фэнтези с использованием метода попаданчества и является вторым произведением захватывающей трилогии … 
Золотые костры, Алексей Юрьевич Пехов,https://enjoybooks.pw/zolotye-kostry/,Захватывающий роман популярного писателя-фантаста является третьим произведением увлекательного цикла «Страж» и представлен в жанре героическое фэнтези. В основе оригинального сюжета … 
Командор войны, Вадим Юрьевич Панов,https://enjoybooks.pw/komandor-vojny/,Увлекательный роман популярного российского писателя представлен в жанре фэнтези и является вторым произведением захватывающего цикла «Тайный город». Созданный новый яркий … 
Человек со Шрамом. Сборник Бог его отцов, Джек Лондон,https://enjoybooks.pw/chelovek-so-shramom/,Джекоб Кент всегда отличался болезненной жадностью. Она переросла в болезнь тяжелой формы в результате он перестал доверять людям. Его скверный … 
Имя ветра, Патрик Ротфусс,https://enjoybooks.pw/imya-vetra/,Будучи еще совсем мальчишкой Квоут путешествовал с бродячими артистами. Это и была его семья. Очередной ночлег труппы обратился настоящей трагедией. … 
Поцелуй теней, Райчел Мид,https://enjoybooks.pw/potseluj-tenej/,"Фреи… Они жили рядом с людьми постоянно, не приметные. Ее изгнали из собственного племени, ее предали самые близкие, она едва … "
Ну разве она не милашка?, Сьюзен Элизабет Филлипс,https://enjoybooks.pw/nu-razve-ona-ne-milashka/,"Пятнадцать лет назад эту девушку ненавидели абсолютно все жители городка. Молодая особа разбила сердце каждому парню в округе, перессорилась с … "
Поцелуй ангела, Сьюзен Элизабет Филлипс,https://enjoybooks.pw/potseluj-angela/,Забыть имя жениха во время свадьбы способна не каждая невеста. Однако Дейзи Девро это удалось с легкостью. Абсолютно не сложно … 
Меж сбитых простыней, Иэн Макьюэн,https://enjoybooks.pw/mezh-sbityh-prostynej/,"Второй по счету сборник рассказов в прозе покажет читателю эксперименты автора в писательском искусстве. Отдельные повести покажут читателю Лондон, переживший … "
Дитя бури, Райчел Мид,https://enjoybooks.pw/ditya-buri/,"Если сила тьмы вторгнется в мир смертных за дело возьмутся экзорцисты и шаманы. Здесь шарлатанов не любят, только дипломированные специалисты! … "
Выбор решает все, Ольга Николаевна Воскресенская,https://enjoybooks.pw/vybor-reshaet-vse/,Многое ли зависит в нашей жизни от выбора? Да практически все. Выберешь короткую дорогу домой – обязательно случится какая-то оказия … 
Путь к себе, Виктория Витальевна Иванова,https://enjoybooks.pw/put-k-sebe/,"Вы встречались со змеелюдом? Нет? Могу сказать Вам повезло. Это дивное существо на вид обычная змея, только размеров побольше. Еще … "
"Франкенштейн, или Современный Прометей", Мэри Уолстонкрафт Шелли,https://enjoybooks.pw/frankenshtejn-ili-sovremennyj-prometej/,"Картограф Волтон отправляется в путь к северному полюсу. Среди льдов холодных земель команда корабля подбирает Виктора Франкенштейна. Придя в себя, … "
Охота на овец, Харуки Мураками,https://enjoybooks.pw/ohota-na-ovets/,Авторская версия давней китайской легенды о вселении души Овцы в человеческое тело. Индивидуальность человека заменяется Овцой. В качестве компенсации он … 
Финансист, Теодор Драйзер,https://enjoybooks.pw/finansist/,Фрэнк Каупервуд в достаточно молодом возрасте достигает ошеломляющего финансового успеха. После гражданской войны он женится и заводит детей. Счастливая полная … 
Песня моряка, Кен Кизи,https://enjoybooks.pw/pesnya-moryaka/,Квинак – небольшой тихий городок в штате Аляска. Близкое расположение к морю определяет основное занятие местного населения – рыбалка и … 
Влюбляясь в твой призрак, Николь Кристи,https://enjoybooks.pw/vlyublyayas-v-tvoj-prizrak/,"Виолет Марсер провела чудесное лето на Гавайях. Однако все хорошее имеет свойство заканчиваться. Пока она отдыхала любимый изменил с подругой, … "
Удача любит рыжих. Трилогия, Лариса Ивановна Телятникова,https://enjoybooks.pw/udacha-lyubit-ryzhih-trilogiya/,"Академия Магических Искусств приняла в свои объятия новых учеников. Поступление – процесс непростой, а обучение и подавно. Впереди ждут интересные … "
Госпожа Бовари, Гюстав Флобер,https://enjoybooks.pw/gospozha-bovari/,"Шарль Бовари всегда покорялся воле матери, как в выборе профессии, так и в поиске будущей жены. Мать женила сына на … "
Не отпускай меня, Кадзуо Исигуро,https://enjoybooks.pw/ne-otpuskaj-menya/,Кэти уже почти тридцать лет. Девушка прекрасно помнит школьное время в Хейлшеме. Весело проводили время вместе с Рут и Томми. … 
Принцессы Огненного мира, Яна Алексеева,https://enjoybooks.pw/printsessy-ognennogo-mira/,Какова цена поражения? Судьба нескольких принцесс. Отныне они не будет томится в роскошных замках. Теперь они заняты исполнением долга – … 
Научи меня умирать, Мацуо Монро,https://enjoybooks.pw/nauchi-menya-umirat/,"Любовь, дружба, материальные и нематериальные ценности – все потеряно. За тобой гоняются полицейские, а ты ведешь милый разговор о высоких … "
Моя любимая ошибка, Челси М. Кэмерон,https://enjoybooks.pw/moya-lyubimaya-oshibka/,"Тейлор Колдвел была ошарашена, когда в качества соседа по комнате к ней подселился Хантер Заккарелли. Мирный способ существовать рядом – … "
Пособие по выживанию, Ника Ветрова,https://enjoybooks.pw/posobie-po-vyzhivaniyu/,"Легкие пути не для ведьм. Так решила ведьма-недоучка Станислава Григорьевна и отправилась к чертям. Тем самым, рогатым, в Академию вредной … "
"Почему вы глупы, больны и бедны…", Рэнди Гейдж,https://enjoybooks.pw/pochemu-vy-glupy-bolny-i-bedny/,"Книга кардинально меняющая сознание человека. Она рассказывает тайны по обретению счастья, здоровья и успеха. Возможно текст написан несколько грубо и … "
Робинзон Крузо, Даниэль Дефо,https://enjoybooks.pw/robinzon-kruzo/,Молодой Робинзон отправляется в путешествие в поисках быстрого способа разбогатеть. Несмотря на все уговоры отца он выбирает морской путь. Первый … 
По ком звонит колокол, Эрнест Миллер Хемингуэй,https://enjoybooks.pw/po-kom-zvonit-kolokol/,"Май 1937 года, конец первого года гражданской войны на территории Испании. В отряд партизан приезжает Роберт Джордан. Американский парень, поклонник … "
Ромео и Джульетта, Уильям Шекспир,https://enjoybooks.pw/romeo-i-dzhuletta/,Вражда двух семей длится долгие годы. И вот очередная ссора прислуги становится новой причиной для возобновления противостояний. Ромео Монтекки безответно … 
Гамлет, Уильям Шекспир,https://enjoybooks.pw/gamlet/,"История о датском принце Гамлете. Его отец умер, и теперь призрак старого короля пугает стражей и жителей замка. Принц принимает … "
И ботаники делают бизнес, Максим Котин,https://enjoybooks.pw/i-botaniki-delayut-biznes/,"Уникальная бизнес-книга о том, как сделать бизнес в России. Для этого не нужно иметь связи, быть бандитом или чиновником. Достаточно … "
Приключения Шерлока Холмса, Артур Конан Дойль,https://enjoybooks.pw/priklyucheniya-sherloka-holmsa/,Много ли вы знаете гениев способных по мельчайшим деталям рассказать человеку половину его жизни? Шерлок Холмс таковым и является! Для … 
Нос, Николай Васильевич Гоголь,https://enjoybooks.pw/nos/,Проснувшись утром карьерист Ковалёв поражен до глубины души отсутствием носа на собственном лице. Отправляясь заявить о пропаже столь важной части … 
Вий, Николай Васильевич Гоголь,https://enjoybooks.pw/vij/,"Думал ли Бурсак Хома, что его каникулы пройдут не так как он того, хотел? Злополучная ночь в доме странной панночки … "
Тарас Бульба, Николай Васильевич Гоголь,https://enjoybooks.pw/taras-bulba/,"Яркий роман о жизни запорожских казаков. Сыновья Остап и Андрий возвращаются с длительного обучения в академии. Отец, Тарас Бульба, пытается … "
Отцы и дети, Иван Сергеевич Тургенев,https://enjoybooks.pw/ottsy-i-deti/,Евгений Базаров молодой человек совершенно отрицающий любые общепринятые нормы и принципы. Его мировоззрение совершенно не понятно родителям в результате чего … 
Самый богатый человек в Вавилоне, Джордж Клейсон,https://enjoybooks.pw/samyj-bogatyj-chelovek-v-vavilone/,"Грамотно обращаться с деньгами – это не врожденный талант, это навык, приобретенный длительным и упорным трудом. Простые правила рассказывают о … "
Малыш и Карлсон, Астрид Линдгрен,https://enjoybooks.pw/malysh-i-karlson/,"Увлекательная книга о настоящей дружбе Малыша, послушного терпеливого ребенка, и, проказника и непоседы, Карлсона. Вместе им предстоит отпраздновать день рождения, … "
Невеста для принца, Шеннон Хейл,https://enjoybooks.pw/nevesta-dlya-printsa/,"Древние предсказания гласят: будущая избранница принца живет в горной деревне. Остался всего лишь год до приезда наследника, именно тогда он … "
Свадьба отменяется. Смотрины, Вера Андреевна Чиркова,https://enjoybooks.pw/smotriny/,"Как избежать женитьбы если родственники ну очень хотят погулять на свадьбе? Король не дождется, когда герцог- племянник найдет себе пару … "
"Богатый папа, бедный папа", Роберт Тору Кийосаки,https://enjoybooks.pw/bogatyj-papa-bednyj-papa/,"Что мы изучаем в школе? Читать, писать, много и усердно работать. Но тем, кто хочет зарабатывать существенные суммы не обязательно … "
Уродливая любовь, Колин Гувер,https://enjoybooks.pw/urodlivaya-lyubov/,Случайную встречу Тейт Коллинз Майлза Арчера нельзя назвать любовью с первого взгляда. Их пару сложно принять за друзей. Они тянутся … 
Вспоминая моих грустных шлюх, Габриэль Гарсия Маркес,https://enjoybooks.pw/vspominaya-moih-grustnyh-shlyuh/,Как может отпраздновать собственное девяностолетие одинокий журналист? Пригласить к себе очередную молодую девушку и провести время в сексуальных утехах. Он … 
Урок первый: Не проклинай своего директора, Елена Звездная,https://enjoybooks.pw/ne-proklinaj-svoego-direktora/,"Ни при каких условиях не насылайте проклятие на директора, тем более сложное высокого уровня. В частности, если ты только начавший … "
Брачная ловушка, Дженнифер Пробст,https://enjoybooks.pw/brachnaya-lovushka/,"Пребывая на смертном одре, отец миллионера Майкла Конте выразил свое последнее желание о скорой женитьбе сына. Любвеобильному мужчине необходимо найти … "
Строптивые, Анастасия Тьюдор,https://enjoybooks.pw/stroptivye/,"Он известный ловелас в городе, не привык получать от понравившейся девушки отказы. Почти все представительницы женского пола готовы отдать многое … "
"Здравствуй, никто", Берли Догерти,https://enjoybooks.pw/zdravstvuj-nikto/,"История любви двух юных созданий. Они всего лишь школьники, жизнь в самом начале, очень многое их ждет впереди. Влюбленные узнают … "
Уличный кот по имени Боб. Как человек и кот обрели надежду на улицах Лондона, Джеймс Боуэн,https://enjoybooks.pw/ulichnyj-kot-po-imeni-bob-kak-chelovek-i-kot-obreli-nadezhdu-na-ulitsah-londona/,"Два одиноких существа существовали на улицах Лондона, балансируя между жизнью и смертью. Джеймс – музыкант, играет на улице, рассчитывает на … "
Пандемониум, Лорен Оливер,https://enjoybooks.pw/pandemonium/,"Вторая книга трилогии продолжит рассказ о будущем нашего мира. Главная героиня произведения Лина, утратившая свою искреннюю любовь в мире, где … "
Пляж, Алекс Гарленд,https://enjoybooks.pw/plyazh/,Отдых на Таиланде слишком быстро надоел группе туристов. Внезапно оказавшаяся в их руках карта таинственного затерянного пляжа пришлась как нельзя … 
Безупречные, Сара Шепард,https://enjoybooks.pw/bezuprechnye/,"Пять подруг все время проводящие вместе. Впрочем, жизнь вносит собственные коррективы. На одной из многочисленных вечеринок пропадает Элисон — лидер … "
Любовник из фантазий, Шеррилин Кеньон,https://enjoybooks.pw/lyubovnik-iz-fantazij/,"Мужчина, который готов удовлетворить каждую женщину – хорошо или плохо? Юлиан считает, что это его тяжкая ноша или, возможно проклятие. … "
Легкое поведение, Миа Эшер,https://enjoybooks.pw/legkoe-povedenie/,"У каждого собственная история любви. У кого-то со счастливым концом, у кого-то с трагическим. Блэр та, кто чаще становится причиной … "
